title,url,description_source,description,meta_description,og_description,twitter_description,body_snippet,html_length,content_type,content_category,text_for_clustering,text_source,text_length
How to Use AI Effectively in Your Dev Projects,https://www.freecodecamp.org/news/how-to-use-ai-effectively-in-your-dev-projects/,meta,"“AI is not going to take your job – but a developer who knows how to use AI will.” I’ve seen this statement everywhere, and it’s the only one about AI taking our jobs that I totally agree with. Software development has changed. It’s not what it used ...","“AI is not going to take your job – but a developer who knows how to use AI will.” I’ve seen this statement everywhere, and it’s the only one about AI taking our jobs that I totally agree with. Software development has changed. It’s not what it used ...","“AI is not going to take your job – but a developer who knows how to use AI will.” I’ve seen this statement everywhere, and it’s the only one about AI taking our jobs that I totally agree with. Software development has changed. It’s not what it used ...","“AI is not going to take your job – but a developer who knows how to use AI will.” I’ve seen this statement everywhere, and it’s the only one about AI taking our jobs that I totally agree with. Software development has changed. It’s not what it used ...","Search Submit your search query Forum Donate July 23, 2025 / #AI How to Use AI Effectively in Your Dev Projects Spruce Emmanuel “AI is not going to take your job – but a developer who knows how to use AI will.” I’ve seen this statement everywhere, and it’s the only one about AI taking our jobs that I totally agree with. Software development has changed. It’s not what it used to be, and that's a go",56165,text/html; charset=utf-8,HTML Pages,"“AI is not going to take your job – but a developer who knows how to use AI will.” I’ve seen this statement everywhere, and it’s the only one about AI taking our jobs that I totally agree with. Software development has changed. It’s not what it used ...",description,253
Humanize AI Text Free Unlimited | 100% Free & No Signup,https://www.zerogpt.plus/en/ai-humanize-text,unknown,,,,,,0,,Unknown/Failed to Load,Humanize AI Text Free Unlimited | 100% Free & No Signup,title,55
IBM Equal Access Toolkit,https://www.ibm.com/able/toolkit/,body,Skip to main content IBM Accessibility Search Switch sites Foundations IBM Brand Center IBM Design Language Implementation Carbon Design System Carbon for IBM Products Carbon for Cloud Carbon for IBM.com IBM Event Design IBM Workplace Design Practices Enterprise Design Thinking IBM Accessibility IBM Design for AI IBM Design Research IBM Experience Standards Community IBM Design Toolkit license Sub,,,,Skip to main content IBM Accessibility Search Switch sites Foundations IBM Brand Center IBM Design Language Implementation Carbon Design System Carbon for IBM Products Carbon for Cloud Carbon for IBM.com IBM Event Design IBM Workplace Design Practices Enterprise Design Thinking IBM Accessibility IBM Design for AI IBM Design Research IBM Experience Standards Community IBM Design Toolkit license Sub,1267139,text/html,HTML Pages,IBM Equal Access Toolkit,description,24
Internal Linking Tool,https://linkstorm.io/,meta,"Improve your internal linking with AI based link suggestions. Try LinkStorm, the new SEO tool for agencies and publishers for free today!","Improve your internal linking with AI based link suggestions. Try LinkStorm, the new SEO tool for agencies and publishers for free today!",,"LinkStorm optimizes your internal linking with AI-driven suggestions, boosting your SEO ranking quickly and effectively.","Pricing Success Stories Resources CMS Integrations Guides Help Center sign in sign up Build relevant internal links effortlessly LinkStorm is an AI-powered internal linking tool for SEOs and publishers. Try it with your website! Analyse Website Your website Checking URL ... Where should we send the link opportunities Checking Email ... Send Link Opportunities Works for any web platform, including ",34207,text/html; charset=utf-8,HTML Pages,"Improve your internal linking with AI based link suggestions. Try LinkStorm, the new SEO tool for agencies and publishers for free today!",description,137
Internships - Phi Kappa Phi,https://internships.phikappaphi.org/,unknown,,,,,,0,,Unknown/Failed to Load,Internships - Phi Kappa Phi,title,27
Internships | Idealist,https://www.idealist.org/en/internships,og,Internships with leading nonprofits and social-impact companies,,Internships with leading nonprofits and social-impact companies,,Idealist Days Find a Job Search Jobs Internships Organizations Resources Nonprofit Salary Explorer Crowdsourced compensation data in the nonprofit sector. Insights for job seekers and employers. Career Advice Informative and practical resources to help guide you throughout your social-impact career. Volunteer Volunteer Find Volunteer Opportunities Search Organizations Resources Volunteer Resources,168124,text/html; charset=utf-8,HTML Pages,Internships with leading nonprofits and social-impact companies,description,63
Interview Crash Courses,https://leetcode.com/explore/interview/,unknown,,,,,,0,,Unknown/Failed to Load,Interview Crash Courses,title,23
Interview Question Predictor,https://scale.jobs/interview-question-predictor,meta,Predict interview questions based on your resume and be prepared for any question they throw at you.,Predict interview questions based on your resume and be prepared for any question they throw at you.,Predict interview questions based on your resume and be prepared for any question they throw at you.,Predict interview questions based on your resume and be prepared for any question they throw at you.,About Us Wall of Love Pricing Free Tools ✨ Resource Library Blog Sign up Login Dropdown Icon Know Their Questions Before They Ask ✨ Upload your resume and get AI-predicted interview questions specific to your experience. Be prepared for what's coming! Loading tool... AI-Powered Prediction Questions tailored to your specific experience and skills Insider Insights Understand why they ask and how to ,62769,text/html; charset=utf-8,HTML Pages,Predict interview questions based on your resume and be prepared for any question they throw at you.,description,100
Interview Questions from top Tech companies,https://prepare.sh/,meta,Discover real interview questions from top companies and prepare with our interactive projects at Prepare.sh. Stay ahead with expert insights and comprehensive preparation tools.,Discover real interview questions from top companies and prepare with our interactive projects at Prepare.sh. Stay ahead with expert insights and comprehensive preparation tools.,Discover real interview questions from top companies and prepare with our interactive labs at Prepare.sh. Stay ahead with expert insights and comprehensive preparation tools.,Discover real interview questions...,"PREPARE.SH 🧪 LABS 🗣️ INTERVIEWS 📊 TRENDS 🎯 ROADMAPS LIVE ENVIRONMENTS PLANS Discord Sign in Settings Sign Out Dark Dark SIGN IN LABS INTERVIEWS TRENDS ROADMAPS LIVE ENVS Interview Questions from top Tech companies Scanned 334,073 interview questions in real-time
					— 🚀 Start Here Oracle +9 other companies 🧠 Hard Real‑Time Error Logger Categorize errors as critical, warning, or info based on thei",628019,text/html,HTML Pages,Discover real interview questions from top companies and prepare with our interactive projects at Prepare.sh. Stay ahead with expert insights and comprehensive preparation tools.,description,178
Interview Questions from Top Tech Companies,https://prepare.sh/,meta,Discover real interview questions from top companies and prepare with our interactive projects at Prepare.sh. Stay ahead with expert insights and comprehensive preparation tools.,Discover real interview questions from top companies and prepare with our interactive projects at Prepare.sh. Stay ahead with expert insights and comprehensive preparation tools.,Discover real interview questions from top companies and prepare with our interactive labs at Prepare.sh. Stay ahead with expert insights and comprehensive preparation tools.,Discover real interview questions...,"PREPARE.SH 🧪 LABS 🗣️ INTERVIEWS 📊 TRENDS 🎯 ROADMAPS LIVE ENVIRONMENTS PLANS Discord Sign in Settings Sign Out Dark Dark SIGN IN LABS INTERVIEWS TRENDS ROADMAPS LIVE ENVS Interview Questions from top Tech companies Scanned 334,073 interview questions in real-time
					— 🚀 Start Here Oracle +9 other companies 🧠 Hard Real‑Time Error Logger Categorize errors as critical, warning, or info based on thei",628019,text/html,HTML Pages,Discover real interview questions from top companies and prepare with our interactive projects at Prepare.sh. Stay ahead with expert insights and comprehensive preparation tools.,description,178
Interview Warmup,https://grow.google/certificates/interview-warmup/,meta,"A quick way to prepare for your next interview. Practice key questions, get insights about your answers, and get more comfortable interviewing.","A quick way to prepare for your next interview. Practice key questions, get insights about your answers, and get more comfortable interviewing.","A quick way to prepare for your next interview. Practice key questions, get insights about your answers, and get more comfortable interviewing.","A quick way to prepare for your next interview. Practice key questions, get insights about your answers, and get more comfortable interviewing.",Jump to Content Career Certificates Foundational Explore our flexible online training programs. Certificates Overview Cybersecurity Data Analytics Digital Marketing & E-commerce IT Support Project Management UX Design Advanced Discover advanced courses to accelerate your career. Advanced Data Analytics Business Intelligence IT Automation with Python Courses Courses Learn new skills in 10 hours or ,254318,text/html; charset=utf-8,HTML Pages,"A quick way to prepare for your next interview. Practice key questions, get insights about your answers, and get more comfortable interviewing.",description,143
Jake's Notes - Iteration vs Recursion,https://notes.ascher.dev/,meta,Jake's Notes,Jake's Notes,Jake's Notes,,,2001,text/html; charset=utf-8,HTML Pages,Jake's Notes - Iteration vs Recursion,title,37
JavaScript Animation Engine,https://animejs.com/,meta,A fast and versatile JavaScript animation library,A fast and versatile JavaScript animation library,A fast and versatile JavaScript animation library,A fast and versatile JavaScript animation library,Anime.js | JavaScript Animation Engine 4.0.0 3.2.2 2.1.0 Docs Easing editor Learn Examples GitHub Sponsor All-in-one animation engine . A fast and versatile JavaScript library to animate the web . npm i animejs Learn more Sponsored by The complete animator's toolbox Break free from browser limitations and animate anything on the web with a single API. Intuitive API Animate faster with an easy-to-u,45266,text/html; charset=utf-8,HTML Pages,A fast and versatile JavaScript animation library,description,49
Job Search | Indeed,https://www.indeed.com/?r=us,unknown,,,,,,0,,Unknown/Failed to Load,Job Search | Indeed,title,19
Jobs - Phi Kappa Phi,https://careers.phikappaphi.org/,unknown,,,,,,0,,Unknown/Failed to Load,Jobs - Phi Kappa Phi,title,20
Jobs | Handshake,https://app.joinhandshake.com/job-search?page=1&per_page=25,unknown,,,,,,0,,Unknown/Failed to Load,Jobs | Handshake,title,16
Jobs | Idealist,https://www.idealist.org/en/jobs?hasSalary=true&jobType=PART_TIME&jobType=TEMPORARY,og,Join Idealist to find a social-impact job and take your career to the next level,,Join Idealist to find a social-impact job and take your career to the next level,,Idealist Days Find a Job Search Jobs Internships Organizations Resources Nonprofit Salary Explorer Crowdsourced compensation data in the nonprofit sector. Insights for job seekers and employers. Career Advice Informative and practical resources to help guide you throughout your social-impact career. Volunteer Volunteer Find Volunteer Opportunities Search Organizations Resources Volunteer Resources,186016,text/html; charset=utf-8,HTML Pages,Join Idealist to find a social-impact job and take your career to the next level,description,80
Jobs | LinkedIn,https://www.linkedin.com/jobs/,meta,64% of job seekers get hired through a referral. Use LinkedIn Jobs to boost your chances of getting hired through people you know.,64% of job seekers get hired through a referral. Use LinkedIn Jobs to boost your chances of getting hired through people you know.,64% of job seekers get hired through a referral. Use LinkedIn Jobs to boost your chances of getting hired through people you know.,64% of job seekers get hired through a referral. Use LinkedIn Jobs to boost your chances of getting hired through people you know.,"Skip to main content Agree & Join LinkedIn By clicking Continue to join or sign in, you agree to LinkedIn’s User Agreement , Privacy Policy , and Cookie Policy . LinkedIn LinkedIn is better on the app Don’t have the app? Get it in the Microsoft Store. Open the app LinkedIn Join now Sign in Millions of jobs and people hiring Email or phone Password Show Forgot password? Sign in or By clicking Conti",151176,text/html; charset=utf-8,HTML Pages,64% of job seekers get hired through a referral. Use LinkedIn Jobs to boost your chances of getting hired through people you know.,description,130
"Jules - tackle bugs, small feature requests, and other software engineering tasks",https://jules.google.com/task,body,Sign in Use your Google Account Email or phone Forgot email? Type the text you hear or see Not your computer? Use Guest mode to sign in privately. Learn more about using Guest mode Next Create account,,,,Sign in Use your Google Account Email or phone Forgot email? Type the text you hear or see Not your computer? Use Guest mode to sign in privately. Learn more about using Guest mode Next Create account,1116179,text/html; charset=utf-8,HTML Pages,Sign in Use your Google Account Email or phone Forgot email? Type the text you hear or see Not your computer? Use Guest mode to sign in privately. Learn more about using Guest mode Next Create account,description,200
Kaggle,https://www.kaggle.com/learn,meta,Practical data skills you can apply immediately: that's what you'll learn in these no-cost courses. They're the fastest (and most fun) way to become a data scientist or improve your current skills.,Practical data skills you can apply immediately: that's what you'll learn in these no-cost courses. They're the fastest (and most fun) way to become a data scientist or improve your current skills.,Practical data skills you can apply immediately: that's what you'll learn in these no-cost courses. They're the fastest (and most fun) way to become a data scientist or improve your current skills.,,,5787,text/html; charset=utf-8,HTML Pages,Practical data skills you can apply immediately: that's what you'll learn in these no-cost courses. They're the fastest (and most fun) way to become a data scientist or improve your current skills.,description,197
Kaggle Competitions,https://www.kaggle.com/competitions,meta,Kaggle is the world’s largest data science community with powerful tools and resources to help you achieve your data science goals.,Kaggle is the world’s largest data science community with powerful tools and resources to help you achieve your data science goals.,,,,5135,text/html; charset=utf-8,HTML Pages,Kaggle is the world’s largest data science community with powerful tools and resources to help you achieve your data science goals.,description,131
"Kanopy - Stream Classic Cinema, Indie Film and Top Documentaries",https://www.kanopy.com/en/uncc/,unknown,,,,,,5002,text/html,HTML Pages,"Kanopy - Stream Classic Cinema, Indie Film and Top Documentaries",title,64
Kirby: Right Back At Ya!,https://drive.google.com/drive/u/0/folders/1LawIFQ48UCdP3-VUan7iWTm4l5EonWYw,body,"JavaScript must be enabled to use Google Drive Learn more Skip to main content Keyboard shortcuts Accessibility feedback Drive Drive Sign in Drive Drive Name Date modified File size View sort options Sort View sort options Sort by Name Date modified Sort direction A to Z Z to A Folders On top Mixed with files Bonus Content! Sep 19, 2023 — Download Microsoft Word A message from SatsumaCat.docx Shar",,,,"JavaScript must be enabled to use Google Drive Learn more Skip to main content Keyboard shortcuts Accessibility feedback Drive Drive Sign in Drive Drive Name Date modified File size View sort options Sort View sort options Sort by Name Date modified Sort direction A to Z Z to A Folders On top Mixed with files Bonus Content! Sep 19, 2023 — Download Microsoft Word A message from SatsumaCat.docx Shar",400021,text/html; charset=utf-8,HTML Pages,Kirby: Right Back At Ya!,description,24
Kirby: Search for the Dreamy Gears!,https://www.tumblr.com/owls-gamblegalaxy/712652029529554944/kirby-search-for-the-dreamy-gears,meta,"""This is the mining town known as Diamond Town. Local airplane pilot Kirby lives a fun, happy life. One day, the town is sent into a fu…","""This is the mining town known as Diamond Town. Local airplane pilot Kirby lives a fun, happy life. One day, the town is sent into a fu…","💬 1  🔁 42  ❤️ 223 · Kirby: Search for the Dreamy Gears! · ""This is the mining town known as Diamond Town. Local airplane pilot Kirby lives a fun, happy life. One day, the town is sent into a fuss w…",,Explore Communities Change palette Sign up Log in owls-gamblegalaxy Kirby: Search for the Dreamy Gears! Keep reading #kirby #king dedede #meta knight #magolor #daroach #waddle dee #millionaire fugo #Kirby: Search for the Dreamy Gears! #kirby light novel #translations 1 42 223 @ owls-gamblegalaxy Sponsored,124669,text/html; charset=utf-8,HTML Pages,"""This is the mining town known as Diamond Town. Local airplane pilot Kirby lives a fun, happy life. One day, the town is sent into a fu…",description,136
Knuckles,https://drive.google.com/drive/folders/1kWWr3kgVmN4mtRuASbIEuDI1Syydq-tn,body,"JavaScript must be enabled to use Google Drive Learn more Skip to main content Keyboard shortcuts Accessibility feedback Drive Drive Sign in Drive Drive Name Date modified File size View sort options Sort View sort options Sort by Name Date modified Sort direction A to Z Z to A Folders On top Mixed with files Video Knuckles - S01 E01.mkv Shared Apr 27, 2024 296.3 MB Download Video Knuckles - S01 E",,,,"JavaScript must be enabled to use Google Drive Learn more Skip to main content Keyboard shortcuts Accessibility feedback Drive Drive Sign in Drive Drive Name Date modified File size View sort options Sort View sort options Sort by Name Date modified Sort direction A to Z Z to A Folders On top Mixed with files Video Knuckles - S01 E01.mkv Shared Apr 27, 2024 296.3 MB Download Video Knuckles - S01 E",340986,text/html; charset=utf-8,HTML Pages,Knuckles,description,8
Learn backend development the smart way | Boot.dev,https://www.boot.dev/,meta,"Welcome to the most captivating, finger-flying, addictive way to learn to code. The smartest way to learn a thing is to ensure you're never bored.","Welcome to the most captivating, finger-flying, addictive way to learn to code. The smartest way to learn a thing is to ensure you're never bored.","Welcome to the most captivating, finger-flying, addictive way to learn to code. The smartest way to learn a thing is to ensure you're never bored.",,"Sign In & Skip Demo → Learn backend development the smart way Welcome to the most captivating, finger-flying, addictive way to learn to code DEMO THE LEARNING PATH (it takes 2 minutes) Join 822,231 students from companies like Mediocrity doesn't cut it anymore The only way to become a great developer is to write a lot of code Avoid tutorial hell by writing a ton of code Stay motivated with a game-",293124,text/html;charset=utf-8,HTML Pages,"Welcome to the most captivating, finger-flying, addictive way to learn to code. The smartest way to learn a thing is to ensure you're never bored.",description,146
Learn Next.js 15 Caching & Rendering,https://www.freecodecamp.org/news/learn-nextjs-15-caching-and-rendering/,meta,"Learn Next.js 15 Caching & Rendering using the App Router. We just posted a course on the freeCodeCamp.org YouTube channel for people who want a clear, engineering-level understanding of how Next.js optimizes performance through smart rendering strat...","Learn Next.js 15 Caching & Rendering using the App Router. We just posted a course on the freeCodeCamp.org YouTube channel for people who want a clear, engineering-level understanding of how Next.js optimizes performance through smart rendering strat...","Learn Next.js 15 Caching & Rendering using the App Router. We just posted a course on the freeCodeCamp.org YouTube channel for people who want a clear, engineering-level understanding of how Next.js optimizes performance through smart rendering strat...","Learn Next.js 15 Caching & Rendering using the App Router. We just posted a course on the freeCodeCamp.org YouTube channel for people who want a clear, engineering-level understanding of how Next.js optimizes performance through smart rendering strat...","Search Submit your search query Forum Donate August 13, 2025 / #Next.js Learn Next.js 15 Caching & Rendering Beau Carnes Learn Next.js 15 Caching & Rendering using the App Router. We just posted a course on the freeCodeCamp.org YouTube channel for people who want a clear, engineering-level understanding of how Next.js optimizes performance through smart rendering strategies and layered caching. Th",39717,text/html; charset=utf-8,HTML Pages,"Learn Next.js 15 Caching & Rendering using the App Router. We just posted a course on the freeCodeCamp.org YouTube channel for people who want a clear, engineering-level understanding of how Next.js optimizes performance through smart rendering strat...",description,253
Learn Python for Data Science,https://www.youtube.com/watch?v=CMEWVn1uZpQ,meta,"Get started with data science using Python! This course covers essential tools like Pandas and NumPy, plus data visualization, cleaning, and machine learning...","Get started with data science using Python! This course covers essential tools like Pandas and NumPy, plus data visualization, cleaning, and machine learning...","Get started with data science using Python! This course covers essential tools like Pandas and NumPy, plus data visualization, cleaning, and machine learning...","Get started with data science using Python! This course covers essential tools like Pandas and NumPy, plus data visualization, cleaning, and machine learning...",About Press Copyright Contact us Creators Advertise Developers Terms Privacy Policy & Safety How YouTube works Test new features NFL Sunday Ticket © 2025 Google LLC,1495495,text/html; charset=utf-8,HTML Pages,"Get started with data science using Python! This course covers essential tools like Pandas and NumPy, plus data visualization, cleaning, and machine learning...",description,160
Learn Time Series Forecasting in Python,https://www.freecodecamp.org/news/learn-time-series-forecasting-in-python/,meta,Learning about time series forecasting in Python is important because it can help predict future trends. We just posted a course on the freeCodeCamp.org YouTube channel that is an introduction to time series forecasting with Python. You’ll learn what...,Learning about time series forecasting in Python is important because it can help predict future trends. We just posted a course on the freeCodeCamp.org YouTube channel that is an introduction to time series forecasting with Python. You’ll learn what...,Learning about time series forecasting in Python is important because it can help predict future trends. We just posted a course on the freeCodeCamp.org YouTube channel that is an introduction to time series forecasting with Python. You’ll learn what...,Learning about time series forecasting in Python is important because it can help predict future trends. We just posted a course on the freeCodeCamp.org YouTube channel that is an introduction to time series forecasting with Python. You’ll learn what...,"Search Submit your search query Forum Donate August 7, 2025 / #Python Learn Time Series Forecasting in Python Beau Carnes Learning about time series forecasting in Python is important because it can help predict future trends. We just posted a course on the freeCodeCamp.org YouTube channel that is an introduction to time series forecasting with Python. You’ll learn what time series data is and how",39047,text/html; charset=utf-8,HTML Pages,Learning about time series forecasting in Python is important because it can help predict future trends. We just posted a course on the freeCodeCamp.org YouTube channel that is an introduction to time series forecasting with Python. You’ll learn what...,description,253
Learn to Code for Free with Coddy.Tech - Code Makes Perfect,https://coddy.tech/,meta,"Learn code in a fun, effective way with Coddy.Tech – enjoy mastering diverse programming languages daily and build skills with ease, all online!","Learn code in a fun, effective way with Coddy.Tech – enjoy mastering diverse programming languages daily and build skills with ease, all online!","Learn code in a fun, effective way with Coddy.Tech – enjoy mastering diverse programming languages daily and build skills with ease, all online!","Learn code in a fun, effective way with Coddy.Tech – enjoy mastering diverse programming languages daily and build skills with ease, all online!",,5109,text/html; charset=utf-8,HTML Pages,"Learn code in a fun, effective way with Coddy.Tech – enjoy mastering diverse programming languages daily and build skills with ease, all online!",description,144
