title,url,description_source,description,meta_description,og_description,twitter_description,body_snippet,html_length,content_type,content_category,text_for_clustering,text_source,text_length
National Do Not Call Registry,https://www.donotcall.gov/,body,"Federal Trade Commission Do Not Call Registry Government Shutdown Notice Due to the government shutdown, we are unable to offer this website service at this time. Information about unwanted calls can be found on the FTC's website at: National Do Not Call Registry | Consumer Information We will resume normal operations when the government is funded. Aviso de cierre del gobierno Debido al cierre del",,,,"Federal Trade Commission Do Not Call Registry Government Shutdown Notice Due to the government shutdown, we are unable to offer this website service at this time. Information about unwanted calls can be found on the FTC's website at: National Do Not Call Registry | Consumer Information We will resume normal operations when the government is funded. Aviso de cierre del gobierno Debido al cierre del",1737,text/html,HTML Pages,National Do Not Call Registry,description,29
neetcode.io,https://neetcode.io/practice,meta,A better way to prepare for coding interviews.,A better way to prepare for coding interviews.,,,,6795,text/html; charset=utf-8,HTML Pages,A better way to prepare for coding interviews.,description,46
nSpire AI - Behavorial Interview Prep,https://web.nspire.ai/talent/behavioral-prep,meta,nSpire AI - Your AI-powered career development platform,nSpire AI - Your AI-powered career development platform,Your AI-powered career development platform,,"JavaScript Required We're sorry, but nSpire AI requires JavaScript to function properly.
          Please enable JavaScript to continue.",2911,text/html,HTML Pages,nSpire AI - Your AI-powered career development platform,description,55
nSpire AI - Mock Interview Prep,https://web.nspire.ai/talent/mock-interview,meta,nSpire AI - Your AI-powered career development platform,nSpire AI - Your AI-powered career development platform,Your AI-powered career development platform,,"JavaScript Required We're sorry, but nSpire AI requires JavaScript to function properly.
          Please enable JavaScript to continue.",2911,text/html,HTML Pages,nSpire AI - Your AI-powered career development platform,description,55
nSpire AI - Technical Interview Prep,https://web.nspire.ai/talent/technical-interview?tab=10,meta,nSpire AI - Your AI-powered career development platform,nSpire AI - Your AI-powered career development platform,Your AI-powered career development platform,,"JavaScript Required We're sorry, but nSpire AI requires JavaScript to function properly.
          Please enable JavaScript to continue.",2911,text/html,HTML Pages,nSpire AI - Your AI-powered career development platform,description,55
nSpire AI RTC Job Board,https://web.nspire.ai/talent/job-board,meta,nSpire AI - Your AI-powered career development platform,nSpire AI - Your AI-powered career development platform,Your AI-powered career development platform,,"JavaScript Required We're sorry, but nSpire AI requires JavaScript to function properly.
          Please enable JavaScript to continue.",2911,text/html,HTML Pages,nSpire AI - Your AI-powered career development platform,description,55
Open Source Alternatives To Proprietary Software,https://opensourcealternative.to/,meta,The world's largest directory for open source software. Discover 500+ popular open source alternatives to proprietary software products. 100% free.,The world's largest directory for open source software. Discover 500+ popular open source alternatives to proprietary software products. 100% free.,,,"Sponsored by Comp AI — The open source compliance automation platform Learn More opensourcealternative.to Discover Sponsor Submit project Open Source Alternatives To Proprietary Software Over 2 million users replaced proprietary software with this directory. Show Filters Found 498 alternatives Godot 102,689 Your open-source game engine Gaming Core 82,245 Local Control, Global Community Automation ",149949,text/html; charset=utf-8,HTML Pages,The world's largest directory for open source software. Discover 500+ popular open source alternatives to proprietary software products. 100% free.,description,147
OpenAI Academy,https://academy.openai.com/?mcp_token=eyJwaWQiOjE3MjIwODgsInNpZCI6MTMyMjQ2Mjk5MiwiYXgiOiIxNmU5ZjhjNDQxODUxZWJmMmE0MzZiODJmNzM3MjE3ZSIsInRzIjoxNzU3Njg1NjgwLCJleHAiOjE3NjAxMDQ4ODB9.ecoE7n3fsyoPFOa3O6DNAHT8hnb1I1wp7lHzPN_IGBk,meta,Unlock the new opportunities of the AI era by equipping yourself with the knowledge and skills to harness artificial intelligence effectively.,Unlock the new opportunities of the AI era by equipping yourself with the knowledge and skills to harness artificial intelligence effectively.,Unlock the new opportunities of the AI era by equipping yourself with the knowledge and skills to harness artificial intelligence effectively.,Unlock the new opportunities of the AI era by equipping yourself with the knowledge and skills to harness artificial intelligence effectively.,OpenAI Academy Search +00:00 GMT SIGN IN Home Events Content Communities What's New Work Education Nonprofits Government Help Home Events Content Communities What's New Work Education Nonprofits Government Help Home OpenAI Academy Unlock the opportunities of the AI era by equipping yourself with the knowledge and skills to harness artificial intelligence effectively. Join Now Expert & Community-Le,362360,text/html; charset=utf-8,HTML Pages,Unlock the new opportunities of the AI era by equipping yourself with the knowledge and skills to harness artificial intelligence effectively.,description,142
PageSpeed Insights,https://pagespeed.web.dev/,body,"This site uses cookies from Google to deliver its services and to analyze traffic. Learn More. Ok, Got it. Enter a valid URL Analyze Make your web pages fast on all devices Check out What's new Documentation Learn about Web Performance",,,,"This site uses cookies from Google to deliver its services and to analyze traffic. Learn More. Ok, Got it. Enter a valid URL Analyze Make your web pages fast on all devices Check out What's new Documentation Learn about Web Performance",175202,text/html; charset=utf-8,HTML Pages,"This site uses cookies from Google to deliver its services and to analyze traffic. Learn More. Ok, Got it. Enter a valid URL Analyze Make your web pages fast on all devices Check out What's new Documentation Learn about Web Performance",description,235
Peer Mentor Guide,https://codepathdotorg.notion.site/peermentorguide,meta,"A tool that connects everyday work into one space. It gives you and your teams AI tools—search, writing, note-taking—inside an all-in-one, flexible workspace.","A tool that connects everyday work into one space. It gives you and your teams AI tools—search, writing, note-taking—inside an all-in-one, flexible workspace.","A tool that connects everyday work into one space. It gives you and your teams AI tools—search, writing, note-taking—inside an all-in-one, flexible workspace.","A tool that connects everyday work into one space. It gives you and your teams AI tools—search, writing, note-taking—inside an all-in-one, flexible workspace.",JavaScript must be enabled in order to use Notion. Please enable JavaScript to continue.,15326,text/html; charset=utf-8,HTML Pages,"A tool that connects everyday work into one space. It gives you and your teams AI tools—search, writing, note-taking—inside an all-in-one, flexible workspace.",description,158
Play Hamilton Original Broadway Cast (Amazon Music Track by Track) by Lin-Manuel Miranda on Amazon Music Unlimited,https://music.amazon.com/albums/B0FQ18J1PD?ref_=dmm_aud_pop_us_cuc2-h_ham-txt_psm_strl_mpla_v-25-a-ca-ln,body,Tuning in,,,,Tuning in,10897,text/html; charset=utf-8,HTML Pages,Play Hamilton Original Broadway Cast (Amazon Music Track by Track) by Lin-Manuel Miranda on Amazon Music Unlimited,title,114
Practice Interviews,https://charlotte.biginterview.com/members/mock_interviews,body,Skip to main content Login via University of North Carolina at Charlotte,,,,Skip to main content Login via University of North Carolina at Charlotte,75098,text/html; charset=utf-8,HTML Pages,Skip to main content Login via University of North Carolina at Charlotte,description,72
Preparation Kits,https://www.hackerrank.com/interview/preparation-kits,meta,Prepare for your upcoming programming interview with Interview Preparation Kit,Prepare for your upcoming programming interview with Interview Preparation Kit,Prepare for your upcoming programming interview with Interview Preparation Kit,,We use cookies to ensure you have the best browsing experience on our website. Please read our cookie policy for more information about how we use cookies. Ok | Prepare Certify Compete Hiring developers? Log In Sign Up Prepare Preparation Kits Interview Preparation Kits Prepare for your Interview Our experts have curated these kits with challenges from top companies & mock tests to assess yourself,776658,text/html; charset=utf-8,HTML Pages,Prepare for your upcoming programming interview with Interview Preparation Kit,description,78
Preparation Kits | HackerRank,https://www.hackerrank.com/interview/preparation-kits,meta,Prepare for your upcoming programming interview with Interview Preparation Kit,Prepare for your upcoming programming interview with Interview Preparation Kit,Prepare for your upcoming programming interview with Interview Preparation Kit,,We use cookies to ensure you have the best browsing experience on our website. Please read our cookie policy for more information about how we use cookies. Ok | Prepare Certify Compete Hiring developers? Log In Sign Up Prepare Preparation Kits Interview Preparation Kits Prepare for your Interview Our experts have curated these kits with challenges from top companies & mock tests to assess yourself,777131,text/html; charset=utf-8,HTML Pages,Prepare for your upcoming programming interview with Interview Preparation Kit,description,78
"price tracker, price history, price watch, price drop alerts, price notifications",https://camelcamelcamel.com/,unknown,,,,,,0,,Unknown/Failed to Load,"price tracker, price history, price watch, price drop alerts, price notifications",title,81
Random Documents,https://drive.google.com/drive/u/0/folders/1mBuXfdKLUsNUCnuSt4Y6e6cDNpq7ZxaS,unknown,,,,,,0,,Unknown/Failed to Load,Random Documents,title,16
React Course for Beginners w/ Tailwind CSS [2025] - YouTube,https://www.youtube.com/watch?v=IJ85kCdqWao,meta,Learn modern frontend web development using React and Tailwind CSS in this beginner course.✏️ This course was developed by Alvin Zablan. Check out Alvin's ch...,Learn modern frontend web development using React and Tailwind CSS in this beginner course.✏️ This course was developed by Alvin Zablan. Check out Alvin's ch...,Learn modern frontend web development using React and Tailwind CSS in this beginner course.✏️ This course was developed by Alvin Zablan. Check out Alvin's ch...,Learn modern frontend web development using React and Tailwind CSS in this beginner course.✏️ This course was developed by Alvin Zablan. Check out Alvin's ch...,About Press Copyright Contact us Creators Advertise Developers Terms Privacy Policy & Safety How YouTube works Test new features NFL Sunday Ticket © 2025 Google LLC,1653933,text/html; charset=utf-8,HTML Pages,Learn modern frontend web development using React and Tailwind CSS in this beginner course.✏️ This course was developed by Alvin Zablan. Check out Alvin's ch...,description,160
red_card-self_srv-english.pdf,https://www.ilrc.org/sites/default/files/documents/red_card-self_srv-english.pdf,non_html,,,,,,91826,application/pdf,Non-HTML Files,red_card-self_srv-english.pdf,title,29
Remove invisible characters & AI Watermarks,https://cleanpaste.site/,unknown,,,,,,0,,Unknown/Failed to Load,Remove invisible characters & AI Watermarks,title,43
Rooms · create,https://rooms.xyz/create,meta,"Create, browse and explore 3D, interactive rooms","Create, browse and explore 3D, interactive rooms","Create, browse and explore 3D, interactive rooms",,"Rooms is a collection of user-generated 3D spaces and a creative tapestry of quirky games, tranquil havens, and clever themes. Available for free on iPhone, iPad and desktop web. Sign In Sign In Rooms Helper Bot × room name author name 00 0,000 created by made with Rooms Caution Beta version. Bugs ahead. Release 39.6 [v39006] @dc32cc96 create Lorem ipsum No Yes One sec... Release 39.6 [v39006] @dc",18655,text/html; charset=utf-8,HTML Pages,"Create, browse and explore 3D, interactive rooms",description,48
Rork — vibe code a mobile app in minutes,https://rork.com/,meta,"Rork builds complete, production-ready mobile apps from your description using AI, Expo, and React Native","Rork builds complete, production-ready mobile apps from your description using AI, Expo, and React Native","Rork builds complete, production-ready mobile apps from your description using AI and React Native","Rork builds complete, production-ready mobile apps from your description using AI and React Native",,23956,text/html; charset=utf-8,HTML Pages,"Rork builds complete, production-ready mobile apps from your description using AI, Expo, and React Native",description,105
Ruby on Rails,https://gorails.com/,meta,"Learn Ruby on Rails, Javascript, Hotwire, Turbo, Stimulus.js, PostgreSQL, MySQL, Ubuntu, and more with GoRails tutorials.","Learn Ruby on Rails, Javascript, Hotwire, Turbo, Stimulus.js, PostgreSQL, MySQL, Ubuntu, and more with GoRails tutorials.","Learn Ruby on Rails, Javascript, Hotwire, Turbo, Stimulus.js, PostgreSQL, MySQL, Ubuntu, and more with GoRails tutorials.","Learn Ruby on Rails, Javascript, Hotwire, Turbo, Stimulus.js, PostgreSQL, MySQL, Ubuntu, and more with GoRails tutorials.","Logo Logo white GoRails Path Series Lessons Forum More Courses Rails for Beginners How to build a complete, real-world application from scratch with Ruby on Rails step by step. Advanced Ruby: Behind the Magic A lot of Ruby code is ""magic"". We'll explain the magic and see how it works using the powerful tools Ruby gives us. Payments with Rails Master Class Accept subscription and one-time payments ",62506,text/html; charset=utf-8,HTML Pages,"Learn Ruby on Rails, Javascript, Hotwire, Turbo, Stimulus.js, PostgreSQL, MySQL, Ubuntu, and more with GoRails tutorials.",description,121
Scam Detector: Website Reviews and Online Scam Protection,https://www.scam-detector.com/,unknown,,,,,,0,,Unknown/Failed to Load,Scam Detector: Website Reviews and Online Scam Protection,title,57
"Scam IQ - Scam Detection Tool - Scan messages for Scam, identify next steps",https://scamiq.app/,meta,"Paste suspicious texts, detect scams instantly, and learn how to protect yourself online with Scam IQ's AI scam detection app.","Paste suspicious texts, detect scams instantly, and learn how to protect yourself online with Scam IQ's AI scam detection app.","Paste suspicious texts, detect scams instantly, and learn how to protect yourself online with Scam IQ's AI scam detection app.",,,10517,text/html; charset=utf-8,HTML Pages,"Paste suspicious texts, detect scams instantly, and learn how to protect yourself online with Scam IQ's AI scam detection app.",description,126
scan@snitcher.space - Detect Email Scams in 30 Seconds,https://snitcher.space/,meta,Forward any suspicious email and get an instant report on whether it's safe or a scam. No account needed. No payment required. Just immediate protection.,Forward any suspicious email and get an instant report on whether it's safe or a scam. No account needed. No payment required. Just immediate protection.,Forward any suspicious email and get an instant report on whether it's safe or a scam.,Forward any suspicious email and get an instant report on whether it's safe or a scam.,"snitcher .space Verified How it works Scam Types Technology FAQ Expose Email Scams. Instantly. Forward any suspicious email to [email protected] to get a detailed scam analysis in seconds. We detect romance scams, fake lotteries, investment fraud, and more. [email protected] Copy Address Scam-specific detection 30-second analysis No account needed Emails deleted after scan How It Works Forward Sus",44035,text/html; charset=utf-8,HTML Pages,Forward any suspicious email and get an instant report on whether it's safe or a scam. No account needed. No payment required. Just immediate protection.,description,153
Scott Pilgrim Comics (+ Others),https://drive.google.com/drive/folders/1g6Pv1G6j3kDcQF9HfcI1qP2BPmNgKtb8,body,"JavaScript must be enabled to use Google Drive Learn more Skip to main content Keyboard shortcuts Accessibility feedback Drive Drive Sign in Drive Drive Name Date modified File size View sort options Sort View sort options Sort by Name Date modified Sort direction A to Z Z to A Folders On top Mixed with files Animation Sep 25, 2023 — Download Comics Sep 25, 2023 — Download Game Apr 25, 2024 — Down",,,,"JavaScript must be enabled to use Google Drive Learn more Skip to main content Keyboard shortcuts Accessibility feedback Drive Drive Sign in Drive Drive Name Date modified File size View sort options Sort View sort options Sort by Name Date modified Sort direction A to Z Z to A Folders On top Mixed with files Animation Sep 25, 2023 — Download Comics Sep 25, 2023 — Download Game Apr 25, 2024 — Down",334940,text/html; charset=utf-8,HTML Pages,Scott Pilgrim Comics (+ Others),description,31
Scott Pilgrim Takes Off (+ Others),https://drive.google.com/drive/folders/1g6Pv1G6j3kDcQF9HfcI1qP2BPmNgKtb8,body,"JavaScript must be enabled to use Google Drive Learn more Skip to main content Keyboard shortcuts Accessibility feedback Drive Drive Sign in Drive Drive Name Date modified File size View sort options Sort View sort options Sort by Name Date modified Sort direction A to Z Z to A Folders On top Mixed with files Animation Sep 25, 2023 — Download Comics Sep 25, 2023 — Download Game Apr 25, 2024 — Down",,,,"JavaScript must be enabled to use Google Drive Learn more Skip to main content Keyboard shortcuts Accessibility feedback Drive Drive Sign in Drive Drive Name Date modified File size View sort options Sort View sort options Sort by Name Date modified Sort direction A to Z Z to A Folders On top Mixed with files Animation Sep 25, 2023 — Download Comics Sep 25, 2023 — Download Game Apr 25, 2024 — Down",334917,text/html; charset=utf-8,HTML Pages,Scott Pilgrim Takes Off (+ Others),description,34
Scott Pilgrim vs The World (+ Others),https://drive.google.com/drive/folders/1g6Pv1G6j3kDcQF9HfcI1qP2BPmNgKtb8,body,"JavaScript must be enabled to use Google Drive Learn more Skip to main content Keyboard shortcuts Accessibility feedback Drive Drive Sign in Drive Drive Name Date modified File size View sort options Sort View sort options Sort by Name Date modified Sort direction A to Z Z to A Folders On top Mixed with files Animation Sep 25, 2023 — Download Comics Sep 25, 2023 — Download Game Apr 25, 2024 — Down",,,,"JavaScript must be enabled to use Google Drive Learn more Skip to main content Keyboard shortcuts Accessibility feedback Drive Drive Sign in Drive Drive Name Date modified File size View sort options Sort View sort options Sort by Name Date modified Sort direction A to Z Z to A Folders On top Mixed with files Animation Sep 25, 2023 — Download Comics Sep 25, 2023 — Download Game Apr 25, 2024 — Down",335015,text/html; charset=utf-8,HTML Pages,Scott Pilgrim vs The World (+ Others),description,37
Scrimba,https://scrimba.com/home,og,"Scrimba is the fast way of learning to code! Our interactive courses and tutorials will teach you React, Vue, Angular, Web Development, Node.JS, JavaScript, HTML, CSS, and more.",,"Scrimba is the fast way of learning to code! Our interactive courses and tutorials will teach you React, Vue, Angular, Web Development, Node.JS, JavaScript, HTML, CSS, and more.",,,4934,text/html; charset=utf-8,HTML Pages,"Scrimba is the fast way of learning to code! Our interactive courses and tutorials will teach you React, Vue, Angular, Web Development, Node.JS, JavaScript, HTML, CSS, and more.",description,177
ServiceNow University | ServiceNow,https://learning.servicenow.com/now/lxp/home,unknown,,,,,,352398,text/html;charset=utf-8,HTML Pages,ServiceNow University | ServiceNow,title,34
Shodan Search Engine,https://www.shodan.io/,meta,Search Engine for the Internet of Things,Search Engine for the Internet of Things,Search engine of Internet-connected devices. Create a free account to get started.,Search engine of Internet-connected devices. Create a free account to get started.,Shodan Maps Images Monitor Developer More... Explore Pricing Login Search Engine for the Internet of Everything Shodan is the world's first search engine for Internet-connected devices. Discover how Internet intelligence can help you make better decisions. Sign Up Now Explore the Platform Beyond the Web Websites are just one part of the Internet. Use Shodan to discover everything from power plants,12843,text/html; charset=utf-8,HTML Pages,Search Engine for the Internet of Things,description,40
"SkillsBuild - AI, Prompting, Using AI",https://skills.yourlearning.ibm.com/activity/PLAN-5445BC385ABC?focuslmsId=ILB-ZKVJNXVZKMZXEWGN,unknown,,,,,,52472,text/html; charset=utf-8,HTML Pages,"SkillsBuild - AI, Prompting, Using AI",title,37
Sliding Window Technique,https://leetcode.com/discuss/post/1773891/sliding-window-technique-and-question-ba-9tt4/,unknown,,,,,,0,,Unknown/Failed to Load,Sliding Window Technique,title,24
SlothBytes: AI Agent Notes,https://hollow-somersault-6ae.notion.site/Ai-Agent-Notes-Work-in-Progress-1eaedc94de5b804bbcace0f2491f9201,meta,"A tool that connects everyday work into one space. It gives you and your teams AI tools—search, writing, note-taking—inside an all-in-one, flexible workspace.","A tool that connects everyday work into one space. It gives you and your teams AI tools—search, writing, note-taking—inside an all-in-one, flexible workspace.","A tool that connects everyday work into one space. It gives you and your teams AI tools—search, writing, note-taking—inside an all-in-one, flexible workspace.","A tool that connects everyday work into one space. It gives you and your teams AI tools—search, writing, note-taking—inside an all-in-one, flexible workspace.",JavaScript must be enabled in order to use Notion. Please enable JavaScript to continue.,15326,text/html; charset=utf-8,HTML Pages,"A tool that connects everyday work into one space. It gives you and your teams AI tools—search, writing, note-taking—inside an all-in-one, flexible workspace.",description,158
Sofia the First,https://www.youtube.com/playlist?list=PL2m1vjiMH_hOgtQnECRAgAzWIDDAkcGub,meta,Available on Disney+ https://ondisneyplus.disney.com/show/sofia-the-first Watch full episodes of Sofia the First! Once upon a time in the kingdom of Enchanci...,Available on Disney+ https://ondisneyplus.disney.com/show/sofia-the-first Watch full episodes of Sofia the First! Once upon a time in the kingdom of Enchanci...,Available on Disney+ https://ondisneyplus.disney.com/show/sofia-the-first Watch full episodes of Sofia the First! Once upon a time in the kingdom of Enchanci...,Available on Disney+ https://ondisneyplus.disney.com/show/sofia-the-first Watch full episodes of Sofia the First! Once upon a time in the kingdom of Enchanci...,About Press Copyright Contact us Creators Advertise Developers Terms Privacy Policy & Safety How YouTube works Test new features NFL Sunday Ticket © 2025 Google LLC,929711,text/html; charset=utf-8,HTML Pages,Available on Disney+ https://ondisneyplus.disney.com/show/sofia-the-first Watch full episodes of Sofia the First! Once upon a time in the kingdom of Enchanci...,description,160
Solvearn - Startup hunting,https://solvearn.net/,meta,"Solvearn connects you with people who share the same vision. Come build your teams, collaborate on projects, and turn ideas into reality.","Solvearn connects you with people who share the same vision. Come build your teams, collaborate on projects, and turn ideas into reality.","Solvearn connects you with people who share the same vision. Come build your teams, collaborate on projects, and turn ideas into reality.",,You need to enable JavaScript to run this app. Privacy Policy Terms & Conditions Discord Instagram →,3222,text/html,HTML Pages,"Solvearn connects you with people who share the same vision. Come build your teams, collaborate on projects, and turn ideas into reality.",description,137
Sources_of_Insoluble_Fiber.png (1545×2000),https://cdn.shopify.com/s/files/1/0670/6164/5484/files/Sources_of_Insoluble_Fiber.png?v=1753472594,non_html,,,,,,1988267,image/png,Non-HTML Files,Sources_of_Insoluble_Fiber.png (1545×2000),title,42
Sources_of_Soluble_Fiber.png (1545×2000),https://cdn.shopify.com/s/files/1/0670/6164/5484/files/Sources_of_Soluble_Fiber.png?v=1753472594,non_html,,,,,,1929944,image/png,Non-HTML Files,Sources_of_Soluble_Fiber.png (1545×2000),title,40
