title,url,description_source,description,meta_description,og_description,twitter_description,body_snippet,html_length,content_type,content_category,text_for_clustering,text_source,text_length
DSA Handbook and Cheatsheets,https://www.techinterviewhandbook.org/algorithms/study-cheatsheet/,meta,"Study guides for coding interviews with focus on data structures and algorithms, including practice questions, techniques, time complexity and recommended resources","Study guides for coding interviews with focus on data structures and algorithms, including practice questions, techniques, time complexity and recommended resources","Study guides for coding interviews with focus on data structures and algorithms, including practice questions, techniques, time complexity and recommended resources",,Skip to main content We collaborated with engineers from Google and Amazon and built the best front end interview preparation platform. Check out GreatFrontEnd today ! Tech Interview Handbook Start reading Coding Algorithms Blog Grind 75 Front End Search Tech Interview Handbook Introduction SWE interviews: What are they and how to prepare Getting an interview Writing your software engineer resume ,44886,text/html; charset=utf-8,HTML Pages,"Study guides for coding interviews with focus on data structures and algorithms, including practice questions, techniques, time complexity and recommended resources",description,164
DSPy,https://dspy.ai/,meta,The framework for programming—rather than prompting—language models.,The framework for programming—rather than prompting—language models.,The framework for programming—rather than prompting—language models.,The framework for programming—rather than prompting—language models.,"Skip to content DSPy Get Started Initializing search stanfordnlp/dspy DSPy in Production Community FAQ Get Started Learn DSPy Tutorials API Reference DSPy stanfordnlp/dspy Get Started Get Started Table of contents 1) Modules help you describe AI behavior as code, not strings. 2) Optimizers tune the prompts and weights of your AI modules. 3) DSPy's Ecosystem advances open-source AI research. Learn ",172901,text/html; charset=utf-8,HTML Pages,The framework for programming—rather than prompting—language models.,description,68
Dynamic Programming,https://leetcode.com/discuss/post/662866/dp-for-beginners-problems-patterns-sampl-atdb/,unknown,,,,,,0,,Unknown/Failed to Load,Dynamic Programming,title,19
e.ggtimer - Simple Countdown Timer,https://e.ggtimer.com/,meta,"e.ggtimer.com is a simple, online countdown timer or egg timer. Set a time and bookmark it for repeated use. You can also create a timer for a specific date or time. Customize your experience with a variety of timer themes.","e.ggtimer.com is a simple, online countdown timer or egg timer. Set a time and bookmark it for repeated use. You can also create a timer for a specific date or time. Customize your experience with a variety of timer themes.",,,You need to enable JavaScript to run this app.,6120,text/html,HTML Pages,"e.ggtimer.com is a simple, online countdown timer or egg timer. Set a time and bookmark it for repeated use. You can also create a timer for a specific date or time. Customize your experience with a variety of timer themes.",description,223
Easily prepare relevant interview stories,https://brawny-kingfisher-50d.notion.site/Easily-prepare-relevant-interview-stories-173517c5e101807d8b33cc4fcd535dd2,meta,"A tool that connects everyday work into one space. It gives you and your teams AI tools—search, writing, note-taking—inside an all-in-one, flexible workspace.","A tool that connects everyday work into one space. It gives you and your teams AI tools—search, writing, note-taking—inside an all-in-one, flexible workspace.","A tool that connects everyday work into one space. It gives you and your teams AI tools—search, writing, note-taking—inside an all-in-one, flexible workspace.","A tool that connects everyday work into one space. It gives you and your teams AI tools—search, writing, note-taking—inside an all-in-one, flexible workspace.",JavaScript must be enabled in order to use Notion. Please enable JavaScript to continue.,15326,text/html; charset=utf-8,HTML Pages,"A tool that connects everyday work into one space. It gives you and your teams AI tools—search, writing, note-taking—inside an all-in-one, flexible workspace.",description,158
Educative,https://www.educative.io/github-students,meta,"Get 6 free months (plus 30% off interview prep courses), and unlock in-demand topics like Machine Learning, Web Development, and more – a value of over $2,000.","Get 6 free months (plus 30% off interview prep courses), and unlock in-demand topics like Machine Learning, Web Development, and more – a value of over $2,000.","Get 6 free months (plus 30% off interview prep courses), and unlock in-demand topics like Machine Learning, Web Development, and more – a value of over $2,000.","Get 6 free months (plus 30% off interview prep courses), and unlock in-demand topics like Machine Learning, Web Development, and more – a value of over $2,000.","Explore Pricing For Business Resources Search Search Log In Join for free GitHub Student Pack Educative has partnered with GitHub to provide the best hands-on learning experience to students How to Get the Scholarship? Get Free Access to 70 + Courses & 30% Off on Standard, Premium, and Premium Plus Subscriptions! Learn in-demand topics such as Machine Learning, Web Development, Python, Kubernetes,",1196788,text/html; charset=utf-8,HTML Pages,"Get 6 free months (plus 30% off interview prep courses), and unlock in-demand topics like Machine Learning, Web Development, and more – a value of over $2,000.",description,159
Ellipsus | Collaborative writing software,https://ellipsus.com/,meta,"Write, edit, and collaborate on any device. Ellipsus is a principled alternative to Google Docs—built for writers, by writers. Sign up for free.","Write, edit, and collaborate on any device. Ellipsus is a principled alternative to Google Docs—built for writers, by writers. Sign up for free.",,,"Product What's new Product tour Resources Blog Help center Merch About Who we are Our stance on AI Sign up Log in Product What's new Product tour Resources Blog Help center Merch About Who we are Our stance on AI Sign up Log in Ellipsus is a collaborative writing tool made for human-to-human creativity. Join the beta Made for creative writers Plenty of tools are made for memos, notes, and to-do li",1559178,text/html; charset=utf-8,HTML Pages,"Write, edit, and collaborate on any device. Ellipsus is a principled alternative to Google Docs—built for writers, by writers. Sign up for free.",description,144
Enrich Student Portal,https://app.enrichscholars.com/dashboard,unknown,,,,,,347,text/html; charset=utf-8,HTML Pages,Enrich Student Portal,title,21
Events - Google Careers,https://www.google.com/about/careers/applications/buildyourfuture/events/,meta,"Where to meet us at events, conferences, and more From campus visits to conferences, symposiums to networking, Google holds and attends all kinds of events. We hope you'll come say &quot;Hi&quot; to us!","Where to meet us at events, conferences, and more From campus visits to conferences, symposiums to networking, Google holds and attends all kinds of events. We hope you'll come say &quot;Hi&quot; to us!",,"Where to meet us at events, conferences, and more From campus visits to conferences, symposiums to networking, Google holds and attends all kinds of events. We hope you'll come say &quot;Hi&quot; to us!",Careers Careers Skip navigation links home home Home Home work_outline work_outline Jobs Jobs noogler_hat noogler_hat Students Students google google How we work How we work handyman handyman How we hire How we hire person_outline person_outline Your career Your career help_outline Help link feedback Send feedback more_vert Help Send Feedback Sign in Careers Careers home Home work_outline Jobs exp,644871,text/html; charset=utf-8,HTML Pages,"Where to meet us at events, conferences, and more From campus visits to conferences, symposiums to networking, Google holds and attends all kinds of events. We hope you'll come say &quot;Hi&quot; to us!",description,202
Ever After High,https://www.youtube.com/playlist?list=PLlrJthtVrvlazGfvryACDvdVH9YlgIJJz,meta,"Share your videos with friends, family, and the world","Share your videos with friends, family, and the world",,,About Press Copyright Contact us Creators Advertise Developers Terms Privacy Policy & Safety How YouTube works Test new features NFL Sunday Ticket © 2025 Google LLC,784218,text/html; charset=utf-8,HTML Pages,"Share your videos with friends, family, and the world",description,53
Excel Cheat Sheet,https://media.datacamp.com/legacy/image/upload/v1674225421/Marketing/Blog/Excel_Cheat_Sheet.pdf,non_html,,,,,,7522326,application/pdf,Non-HTML Files,Excel Cheat Sheet,title,17
Excel Keyboard Shortcuts,https://media.datacamp.com/legacy/image/upload/v1700047731/Marketing/Blog/Excel_Keyboard_Shortcuts_Cheat_Sheet.pdf,non_html,,,,,,2368282,application/pdf,Non-HTML Files,Excel Keyboard Shortcuts,title,24
Explore All Free AI Content Generator Tools | Saze AI,https://sazeai.com/tools,meta,Unleash your creativity and boost productivity with our cutting-edge AI Content Generator tools. Discover a wide range of free AI tools for various tasks.,Unleash your creativity and boost productivity with our cutting-edge AI Content Generator tools. Discover a wide range of free AI tools for various tasks.,Access 40+ free AI tools to boost your productivity and enhance content quality.,Access 40+ free AI tools to boost your productivity and enhance content quality.,Home AI Tools Blog Home Blog AI Tools - Advertisement - Explore All Free AI Tools Unleash your creativity and boost productivity with our cutting-edge AI-powered tools. Popular AI Influencer Generator Create Realistic Social Media AI Influencer Popular AI PDF Summarizer Upload PDF and get an AI-generated summary! AI Answer Generator Generate precise answers to your questions using AI. Hot AI Image,158664,text/html; charset=utf-8,HTML Pages,Unleash your creativity and boost productivity with our cutting-edge AI Content Generator tools. Discover a wide range of free AI tools for various tasks.,description,154
Fast Track - Learn how interviews work,https://charlotte.biginterview.com/members/curriculum/fast_track,body,Skip to main content Login via University of North Carolina at Charlotte,,,,Skip to main content Login via University of North Carolina at Charlotte,75098,text/html; charset=utf-8,HTML Pages,Skip to main content Login via University of North Carolina at Charlotte,description,72
Feedough - Product Requirements Document (PRD) Generator,https://www.feedough.com/ai-product-requirements-document-prd-generator/,meta,"The AI Product Requirements Document Generator helps create a first draft quickly. You add the basics, and it builds a clear structure.","The AI Product Requirements Document Generator helps create a first draft quickly. You add the basics, and it builds a clear structure.","The AI Product Requirements Document Generator helps create a first draft quickly. You add the basics, and it builds a clear structure.",,Categories AI AI Statistics AI Tools AI Ideation Tools AI Tools For Market Research and Validation AI Tools For Business Planning AI Branding Tools AI Tools for Product Development AI Tools for Marketing and Sales AI Tools for Emailing AI Tools for Funding and Finance AI Tools For Operations and Management AI Tools for HR Management AI Personal Branding and Networking Tools AI Tools For Customer E,335166,text/html; charset=utf-8,HTML Pages,"The AI Product Requirements Document Generator helps create a first draft quickly. You add the basics, and it builds a clear structure.",description,135
Felo - Your Free AI Search Engine,https://dev.felo.ai/search,meta,"Ask AI anything with Felo, the free multilingual answer engine. Get real-time answers & create AI presentations, AI mind maps & posters.","Ask AI anything with Felo, the free multilingual answer engine. Get real-time answers & create AI presentations, AI mind maps & posters.",無料の日本語AIアシスタント。最新情報を検索し、AIプレゼン作成、マインドマップ、文書読み取り、画像生成など多機能搭載！,無料の日本語AIアシスタント。最新情報を検索し、AIプレゼン作成、マインドマップ、文書読み取り、画像生成など多機能搭載！,"F e l o App F e l o Search Research Analysis AI Slide AI Page More Search Research Analysis AI Slide AI Page More Drop your files here Web Pro Traditional Search Press Ctrl+Enter to search for ""webpage"" and ""link"" Beta Felo LiveDoc Beta: start a new era of work today Creative Inspiration Research Analysis View Case Market Situation Analysis AI Slide View Case New Product Introduction AI Page View ",288326,text/html; charset=utf-8,HTML Pages,"Ask AI anything with Felo, the free multilingual answer engine. Get real-time answers & create AI presentations, AI mind maps & posters.",description,136
Firebase Studio,https://studio.firebase.google.com/?pli=1,meta,"Firebase Studio is an entirely web-based workspace for full-stack application development, complete with the latest generative AI from Gemini, and full-fidelity app previews, powered by cloud emulators.","Firebase Studio is an entirely web-based workspace for full-stack application development, complete with the latest generative AI from Gemini, and full-fidelity app previews, powered by cloud emulators.","Firebase Studio is an entirely web-based workspace for full-stack application development, complete with the latest generative AI from Gemini, and full-fidelity app previews, powered by cloud emulators.",,"Firebase Studio Menu Home Docs Support Get Started Firebase Studio The full stack AI workspace Firebase Studio accelerates your entire development lifecycle with AI agents. Build backends, front ends, and mobile apps, all in one place. Try Firebase Studio Get to work quickly wherever you are Go from opening your browser to building in minutes, not hours. Import your existing repositories from GitH",178479,text/html; charset=utf-8,HTML Pages,"Firebase Studio is an entirely web-based workspace for full-stack application development, complete with the latest generative AI from Gemini, and full-fidelity app previews, powered by cloud emulators.",description,202
FounderSignal - Validate Your Startup Idea in 72 Hours | FounderSignal,https://foundersignal.app/,meta,"Stop guessing. Start validating. FounderSignal helps you test your startup ideas with real users and data-driven insights in under 72 hours. Build your MVP, get feedback, and find your market.","Stop guessing. Start validating. FounderSignal helps you test your startup ideas with real users and data-driven insights in under 72 hours. Build your MVP, get feedback, and find your market.","Stop guessing. Start validating. FounderSignal helps you test your startup ideas with real users and data-driven insights in under 72 hours. Build your MVP, get feedback, and find your market.","Stop guessing. Start validating. FounderSignal helps you test your startup ideas with real users and data-driven insights in under 72 hours. Build your MVP, get feedback, and find your market.","Explore Ideas Submit Idea Pricing Sign Up Toggle menu 🎉 First 100 users get 25% OFF on Pro Monthly Plan! CODE: EARLYBIRDPRO Claim Offer Stop guessing. Start validating. Validate Your Startup Idea in 72 Hours Get real-time market insights with a no-code fake MVP . Understand user demand, refine your concept, and launch with confidence. Start Your Free Validation How It Works How FounderSignal Works",98468,text/html; charset=utf-8,HTML Pages,"Stop guessing. Start validating. FounderSignal helps you test your startup ideas with real users and data-driven insights in under 72 hours. Build your MVP, get feedback, and find your market.",description,192
Founderz | Online Business School,https://learn.founderz.com/,meta,Learn the most in-demand skills of the future through Founderz’s innovation programs. Join a global community of unstoppable humans!,Learn the most in-demand skills of the future through Founderz’s innovation programs. Join a global community of unstoppable humans!,Learn the most in-demand skills of the future through Founderz’s innovation programs. Join a global community of unstoppable humans!,Learn the most in-demand skills of the future through Founderz’s innovation programs. Join a global community of unstoppable humans!,Login Don't have an account? Sign up today. Stay signed in Forgot password? Login,8564,text/html; charset=utf-8,HTML Pages,Learn the most in-demand skills of the future through Founderz’s innovation programs. Join a global community of unstoppable humans!,description,132
Free Download Books,https://oceanofpdf.com/,unknown,,,,,,0,,Unknown/Failed to Load,Free Download Books,title,19
FreeCodeCamp: The Agentic AI Handbook,https://www.freecodecamp.org/news/the-agentic-ai-handbook/,meta,"You may have heard about “Agentic AI” systems and wondered what they’re all about. Well, in basic terms, the idea behind Agentic AI is that it can see its surroundings, set and pursue goals, plan and reason through many processes, and learn from expe...","You may have heard about “Agentic AI” systems and wondered what they’re all about. Well, in basic terms, the idea behind Agentic AI is that it can see its surroundings, set and pursue goals, plan and reason through many processes, and learn from expe...","You may have heard about “Agentic AI” systems and wondered what they’re all about. Well, in basic terms, the idea behind Agentic AI is that it can see its surroundings, set and pursue goals, plan and reason through many processes, and learn from expe...","You may have heard about “Agentic AI” systems and wondered what they’re all about. Well, in basic terms, the idea behind Agentic AI is that it can see its surroundings, set and pursue goals, plan and reason through many processes, and learn from expe...","Search Submit your search query Forum Donate May 28, 2025 / #AI The Agentic AI Handbook: A Beginner's Guide to Autonomous Intelligent Agents Balajee Asish Brahmandam You may have heard about “Agentic AI” systems and wondered what they’re all about. Well, in basic terms, the idea behind Agentic AI is that it can see its surroundings, set and pursue goals, plan and reason through many processes, and",85217,text/html; charset=utf-8,HTML Pages,"You may have heard about “Agentic AI” systems and wondered what they’re all about. Well, in basic terms, the idea behind Agentic AI is that it can see its surroundings, set and pursue goals, plan and reason through many processes, and learn from expe...",description,253
freeCodeCamp.org,https://www.freecodecamp.org/learn/full-stack-developer/,twitter,Learn to Code — For Free,,,Learn to Code — For Free,,395126,text/html; charset=utf-8,HTML Pages,freeCodeCamp.org,title,16
FreeForStudents - Exclusive Student Freebies & Deals,https://freeforstudents.org/us,meta,"Student life just got a whole lot better. Dive into our curated collection of exclusive deals and freebies, tailored for you. Save big on the products you love!","Student life just got a whole lot better. Dive into our curated collection of exclusive deals and freebies, tailored for you. Save big on the products you love!",,,Close Search Blog United Kingdom United States India Rest of World Search Featured Education Software & Tools Technology Shopping Entertainment Health & Wellbeing 🔥 NEW! Get 5% cashback at Amazon with a FREE Prime Student subscription! (US only) Get Prime Student Limited Time Only Amazon Free Amazon Prime (plus 5% cashback) Available in United States Recently Added Grubhub (Prime Perk) $0 Delivery,389580,text/html; charset=utf-8,HTML Pages,"Student life just got a whole lot better. Dive into our curated collection of exclusive deals and freebies, tailored for you. Save big on the products you love!",description,160
From Idea to Launch – The Ultimate Tool Stack for Indie Hackers,https://www.freecodecamp.org/news/ultimate-tool-stack-for-indie-hackers/,meta,"If you’re building something on your own, you don’t have time to mess around with bloated platforms or complicated setups.  You want tools that work, tools that feel intuitive, and tools that help you move quickly from idea to launch.  This article w...","If you’re building something on your own, you don’t have time to mess around with bloated platforms or complicated setups.  You want tools that work, tools that feel intuitive, and tools that help you move quickly from idea to launch.  This article w...","If you’re building something on your own, you don’t have time to mess around with bloated platforms or complicated setups.  You want tools that work, tools that feel intuitive, and tools that help you move quickly from idea to launch.  This article w...","If you’re building something on your own, you don’t have time to mess around with bloated platforms or complicated setups.  You want tools that work, tools that feel intuitive, and tools that help you move quickly from idea to launch.  This article w...","Search Submit your search query Forum Donate July 24, 2025 / #Web Development From Idea to Launch – The Ultimate Tool Stack for Indie Hackers Manish Shivanandhan If you’re building something on your own, you don’t have time to mess around with bloated platforms or complicated setups. You want tools that work, tools that feel intuitive, and tools that help you move quickly from idea to launch. This",50455,text/html; charset=utf-8,HTML Pages,"If you’re building something on your own, you don’t have time to mess around with bloated platforms or complicated setups.  You want tools that work, tools that feel intuitive, and tools that help you move quickly from idea to launch.  This article w...",description,253
Frontend Behavioral Interview Questions | FrontendLead,https://frontendlead.com/behavioral-questions,meta,Prepare for the soft side of tech interviews with our comprehensive list of behavioral questions specifically curated for frontend roles.,Prepare for the soft side of tech interviews with our comprehensive list of behavioral questions specifically curated for frontend roles.,Prepare for the soft side of tech interviews with our comprehensive list of behavioral questions specifically curated for frontend roles.,,Limited offer: Get 10% off any plan for the first month with code SUN - Offer Ends in 0 Days - View Plans Dismiss FrontendLead home page Interview Questions Coding Questions System Design Questions Trivia Questions Behavioral Questions Company Specific Questions Community Discussion Discussion Board Exclusive Discord New Study Plans Blog Frontend Interview Handbook Pricing Sign In / Up Home Interv,48709,text/html; charset=utf-8,HTML Pages,Prepare for the soft side of tech interviews with our comprehensive list of behavioral questions specifically curated for frontend roles.,description,137
Frontend System Design Fundamentals (All In One Guide),https://frontendlead.com/system-design,meta,"Explore in-depth Frontend System Design interview questions tailored for top tech roles. Get insights and strategies for complex architecture and design challenges, with interactive solutions.","Explore in-depth Frontend System Design interview questions tailored for top tech roles. Get insights and strategies for complex architecture and design challenges, with interactive solutions.","Explore in-depth Frontend System Design interview questions tailored for top tech roles. Get insights and strategies for complex architecture and design challenges, with interactive solutions.",,Limited offer: Get 10% off any plan for the first month with code SUN - Offer Ends in 0 Days - View Plans Dismiss FrontendLead home page Interview Questions Coding Questions System Design Questions Trivia Questions Behavioral Questions Company Specific Questions Community Discussion Discussion Board Exclusive Discord New Study Plans Blog Frontend Interview Handbook Pricing Sign In / Up Home Interv,48867,text/html; charset=utf-8,HTML Pages,"Explore in-depth Frontend System Design interview questions tailored for top tech roles. Get insights and strategies for complex architecture and design challenges, with interactive solutions.",description,192
Frontend Trivia Questions | FrontendLead,https://frontendlead.com/trivia-questions,meta,Test your frontend knowledge with our curated list of trivia questions.  Perfect for brushing up on the fundamentals or prepping for interviews.,Test your frontend knowledge with our curated list of trivia questions.  Perfect for brushing up on the fundamentals or prepping for interviews.,Test your frontend knowledge with our curated list of trivia questions.  Perfect for brushing up on the fundamentals or prepping for interviews.,,Limited offer: Get 10% off any plan for the first month with code SUN - Offer Ends in 0 Days - View Plans Dismiss FrontendLead home page Interview Questions Coding Questions System Design Questions Trivia Questions Behavioral Questions Company Specific Questions Community Discussion Discussion Board Exclusive Discord New Study Plans Blog Frontend Interview Handbook Pricing Sign In / Up Home Interv,48628,text/html; charset=utf-8,HTML Pages,Test your frontend knowledge with our curated list of trivia questions.  Perfect for brushing up on the fundamentals or prepping for interviews.,description,144
