title,url,description_source,description,meta_description,og_description,twitter_description,body_snippet,html_length,content_type,content_category,text_for_clustering,text_source,text_length
@lc-holy - Miraculous & Spy x Family AUs,https://www.tumblr.com/lc-holy,meta,"French artist |  You can repost/translate my comics or my art, but please credit me!","French artist |  You can repost/translate my comics or my art, but please credit me!","French artist |  You can repost/translate my comics or my art, but please credit me!",,"Explore Communities Change palette Sign up Log in LC-Holy @ lc-holy French artist |  You can repost/translate my comics or my art, but please credit me! Follow Posts Pinned lc-holy Links to my comics and others “You don’t understand” [Part 1-1] , [Part 1-2] , [Part 2-1] , [Part 2-2] , [Part 3-1 ] , [Part 3-2] , [Part 4-1] , [Part 4-2 (Final)] I also put links to questions about my comic I have bee",556703,text/html; charset=utf-8,HTML Pages,"French artist |  You can repost/translate my comics or my art, but please credit me!",description,84
9anime - Watch Anime online with DUB and SUB for FREE,https://9animetv.to/,meta,9anime is the best free anime streaming website where you can watch English Subbed and Dubbed anime online. WATCH NOW! No Ads GUARANTEED!,9anime is the best free anime streaming website where you can watch English Subbed and Dubbed anime online. WATCH NOW! No Ads GUARANTEED!,9anime is the best free anime streaming website where you can watch English Subbed and Dubbed anime online. WATCH NOW! No Ads GUARANTEED!,,Home Genres Action Adventure Cars Comedy Dementia Demons Drama Ecchi Fantasy Game Harem Historical Horror Isekai Josei Kids Magic Martial Arts Mecha Military Music Mystery Parody Police Psychological Romance Samurai School Sci-Fi Seinen Shoujo Shoujo Ai Shounen Shounen Ai Slice of Life Space Sports Super Power Supernatural Thriller Vampire Types Movies TV Series OVAs ONAs Specials Updated Added On,95718,text/html; charset=utf-8,HTML Pages,9anime is the best free anime streaming website where you can watch English Subbed and Dubbed anime online. WATCH NOW! No Ads GUARANTEED!,description,137
A Practical Guide to Building Agents,https://cdn.openai.com/business-guides-and-resources/a-practical-guide-to-building-agents.pdf?mcp_token=eyJwaWQiOjE3MjIwODgsInNpZCI6MTA0ODY0MzA5MCwiYXgiOiI5ZTQyYTg3NmMwMjg0MzBmMWM3ZmY3NjgxNmY4ZDE3ZiIsInRzIjoxNzUyODQ0NjYzLCJleHAiOjE3NTUyNjM4NjN9.bMLlLtW44gdsC59Ue0RRib1FUxB31nwceQ-PXFNx0mM,non_html,,,,,,6955858,application/pdf,Non-HTML Files,A Practical Guide to Building Agents,title,36
AI Automation Agency Playbook,https://1to10x.ai/wp-content/uploads/2025/06/AI-Automation-Specialist.pdf,non_html,,,,,,42330939,application/pdf,Non-HTML Files,AI Automation Agency Playbook,title,29
AI Skills 4 Women Handbook,file:///C:/Users/hp/Downloads/AI%20SKILLS%204%20WOMEN.pdf,unknown,,,,,,0,,Unknown/Failed to Load,AI Skills 4 Women Handbook,title,26
Alison,https://alison.com/,meta,"Free online courses with certificates. Join 15 million graduates and empower your career. Study, learn, certify, upskill with free online learning and training","Free online courses with certificates. Join 15 million graduates and empower your career. Study, learn, certify, upskill with free online learning and training","Free online courses with certificates. Join 15 million graduates and empower your career. Study, learn, certify, upskill with free online learning and training","Free online courses with certificates. Join 15 million graduates and empower your career. Study, learn, certify, upskill with free online learning and training","Select Site Language English Spanish End of October SALE! 🎃 25% off certs & diplomas now on Ends in : : : Claim your Discount! en Top Free Courses Most Popular Searches Information Systems Human Resources Business Management Your Recent Searches Explore Courses professional/header.all_diploma_courses professional/header.all_certificate_courses Information Technology (IT) (1,277 Courses) Health (1,",191616,text/html; charset=utf-8,HTML Pages,"Free online courses with certificates. Join 15 million graduates and empower your career. Study, learn, certify, upskill with free online learning and training",description,159
Anaconda,https://learning.anaconda.com/collections,body,Skip to main content Anaconda Learning Toggle menu Menu Back to anaconda.com <  Back to anaconda.com Course Catalog Sign In Products 1-2 hr <1 hr 2-3 hr 3-4 hr >4 hr AI / Machine Learning Engineer All Products Anaconda Tools Artificial Intelligence Beginner Certification conda Data Analysis Data Analyst / Business Analyst Data Cleaning Data Engineer Data Engineering Data Science Data Scientist Dat,,,,Skip to main content Anaconda Learning Toggle menu Menu Back to anaconda.com <  Back to anaconda.com Course Catalog Sign In Products 1-2 hr <1 hr 2-3 hr 3-4 hr >4 hr AI / Machine Learning Engineer All Products Anaconda Tools Artificial Intelligence Beginner Certification conda Data Analysis Data Analyst / Business Analyst Data Cleaning Data Engineer Data Engineering Data Science Data Scientist Dat,3013962,text/html; charset=utf-8,HTML Pages,Anaconda,description,8
Anaconda Learning,https://learning.anaconda.com/collections,body,Skip to main content Anaconda Learning Toggle menu Menu Back to anaconda.com <  Back to anaconda.com Course Catalog Sign In Products 1-2 hr <1 hr 2-3 hr 3-4 hr >4 hr AI / Machine Learning Engineer All Products Anaconda Tools Artificial Intelligence Beginner Certification conda Data Analysis Data Analyst / Business Analyst Data Cleaning Data Engineer Data Engineering Data Science Data Scientist Dat,,,,Skip to main content Anaconda Learning Toggle menu Menu Back to anaconda.com <  Back to anaconda.com Course Catalog Sign In Products 1-2 hr <1 hr 2-3 hr 3-4 hr >4 hr AI / Machine Learning Engineer All Products Anaconda Tools Artificial Intelligence Beginner Certification conda Data Analysis Data Analyst / Business Analyst Data Cleaning Data Engineer Data Engineering Data Science Data Scientist Dat,3013962,text/html; charset=utf-8,HTML Pages,Anaconda Learning,description,17
Anara | Trustworthy Research Platform,https://anara.com/,meta,"Automate your research workflows with Anara's AI. Build research library, verify sources, and collaborate with your team. Trusted by researchers worldwide.","Automate your research workflows with Anara's AI. Build research library, verify sources, and collaborate with your team. Trusted by researchers worldwide.",,,"Use cases Resources Pricing Careers Contact sales Log in Get Anara free Toggle menu AI workspace for scientists, students, and research teams Search for papers, extract key passages, organize research and create flashcards — all without sacrificing academic rigor Get Anara free Request demo Trusted by 2,000,000+ researchers and students Built specifically for academic workflows Get more accurate r",169534,text/html; charset=utf-8,HTML Pages,"Automate your research workflows with Anara's AI. Build research library, verify sources, and collaborate with your team. Trusted by researchers worldwide.",description,155
Anime,https://hianime.to/,meta,HiAnime is a Free anime streaming website which you can watch English Subbed and Dubbed Anime online with No Account and Daily update. WATCH NOW!,HiAnime is a Free anime streaming website which you can watch English Subbed and Dubbed Anime online with No Account and Daily update. WATCH NOW!,HiAnime is a Free anime streaming website which you can watch English Subbed and Dubbed Anime online with No Account and Daily update. WATCH NOW!,,Menu Home Movies TV Series Most Popular Top Airing Top search: Chainsaw Man the Movie: Reze Arc One Piece One-Punch Man Season 3 Demon Slayer: Kimetsu no Yaiba Infinity Castle My Hero Academia Final Season Chainsaw Man Attack on Titan Disney Twisted-Wonderland The Animation: Episode of Heartslabyul One Punch Man Demon Slayer: Kimetsu no Yaiba Watch anime Share HiAnime to your friends HiAnime.to - ,86395,text/html; charset=utf-8,HTML Pages,HiAnime is a Free anime streaming website which you can watch English Subbed and Dubbed Anime online with No Account and Daily update. WATCH NOW!,description,145
Apply | HackerRank,https://www.hackerrank.com/apply,meta,"Join over 28 million developers in solving code challenges on HackerRank, one of the best ways to prepare for programming interviews.","Join over 28 million developers in solving code challenges on HackerRank, one of the best ways to prepare for programming interviews.","Join over 28 million developers in solving code challenges on HackerRank, one of the best ways to prepare for programming interviews.",,"| Prepare Certify Compete Prepare Certify Compete Log In Sign Up We're sunsetting the Apply tab soon. Thank you for trying our feature as we double down to focus on helping developers prepare to become the next-gen developer. Apply Get Your Dream Job Wishlisted jobs Role Experience Location Company Adeeba E-Services Private Limited ""Great Career Opportunity in Adeeba .""Inbound Tech Support India B",321463,text/html; charset=utf-8,HTML Pages,"Join over 28 million developers in solving code challenges on HackerRank, one of the best ways to prepare for programming interviews.",description,133
Articles,https://www.paperspan.com/list,unknown,,,,,,1736,text/html; charset=utf-8,HTML Pages,Articles,title,8
ascherj/neetcode-250-guide,https://github.com/ascherj/neetcode-250-guide,meta,"Intelligent 125-day coding interview prep planner covering all 250 NeetCode problems. Features spaced repetition, progressive difficulty scaling, and same-category daily pairing for optimal pattern recognition and retention. - ascherj/neetcode-250-guide","Intelligent 125-day coding interview prep planner covering all 250 NeetCode problems. Features spaced repetition, progressive difficulty scaling, and same-category daily pairing for optimal pattern recognition and retention. - ascherj/neetcode-250-guide","Intelligent 125-day coding interview prep planner covering all 250 NeetCode problems. Features spaced repetition, progressive difficulty scaling, and same-category daily pairing for optimal pattern...","Intelligent 125-day coding interview prep planner covering all 250 NeetCode problems. Features spaced repetition, progressive difficulty scaling, and same-category daily pairing for optimal pattern...",Skip to content Navigation Menu Toggle navigation Sign in Appearance settings Platform AI CODE CREATION GitHub Copilot Write better code with AI GitHub Spark Build and deploy intelligent apps GitHub Models Manage and compare prompts MCP Registry New Discover and integrate external tools DEVELOPER WORKFLOWS Actions Automate any workflow Codespaces Instant dev environments Issues Plan and track work,285447,text/html; charset=utf-8,HTML Pages,"Intelligent 125-day coding interview prep planner covering all 250 NeetCode problems. Features spaced repetition, progressive difficulty scaling, and same-category daily pairing for optimal pattern recognition and retention. - ascherj/neetcode-250-guide",description,253
Barbie movies,https://drive.google.com/drive/folders/1-haquav2KQosUnVwNfqoQjfxv1coVYtu,body,"JavaScript must be enabled to use Google Drive Learn more Skip to main content Keyboard shortcuts Accessibility feedback Drive Drive Sign in Drive Drive Name Date modified File size View sort options Sort View sort options Sort by Name Date modified Sort direction A to Z Z to A Folders On top Mixed with files Video Barbie & Her Sisters in a Pony Tale Shared Aug 10, 2022 858 MB Download Video Barbi",,,,"JavaScript must be enabled to use Google Drive Learn more Skip to main content Keyboard shortcuts Accessibility feedback Drive Drive Sign in Drive Drive Name Date modified File size View sort options Sort View sort options Sort by Name Date modified Sort direction A to Z Z to A Folders On top Mixed with files Video Barbie & Her Sisters in a Pony Tale Shared Aug 10, 2022 858 MB Download Video Barbi",386702,text/html; charset=utf-8,HTML Pages,Barbie movies,description,13
Be There Certificate,https://www.betherecertificate.org/be-there-certificate,meta,Overview of the Be There Certificate course.,Overview of the Be There Certificate course.,Overview of the Be There Certificate course.,,"Skip to main content Resume Course Donate Now Resume Course Donate Now About Course Outline Register Log Out Log In My Account Data Dashboard Resources In an Emergency This is not a site for personal disclosure of mental health distress, or suicidal thoughts or behaviours. If you or someone you know is in crisis, please call a helpline ( like these ), 9-1-1 or emergency services or go to your near",47193,text/html,HTML Pages,Overview of the Be There Certificate course.,description,44
Beautiful themes for shadcn/ui — tweakcn | Theme Editor & Generator,https://tweakcn.com/,meta,"Customize theme for shadcn/ui with tweakcn's interactive editor. Supports Tailwind CSS v4, Shadcn UI, and custom styles. Modify properties, preview changes, and get the code in real time.","Customize theme for shadcn/ui with tweakcn's interactive editor. Supports Tailwind CSS v4, Shadcn UI, and custom styles. Modify properties, preview changes, and get the code in real time.","Customize theme for shadcn/ui with tweakcn's interactive editor. Supports Tailwind CSS v4, Shadcn UI, and custom styles. Modify properties, preview changes, and get the code in real time.","Customize theme for shadcn/ui with tweakcn's interactive editor. Supports Tailwind CSS v4, Shadcn UI, and custom styles. Modify properties, preview changes, and get the code in real time.",,55578,text/html; charset=utf-8,HTML Pages,"Customize theme for shadcn/ui with tweakcn's interactive editor. Supports Tailwind CSS v4, Shadcn UI, and custom styles. Modify properties, preview changes, and get the code in real time.",description,187
Beginner's Guide to the 12-3-30 Workout,https://www.planetfitness.com/blog/articles/12-3-30-workout,unknown,,,,,,0,,Unknown/Failed to Load,Beginner's Guide to the 12-3-30 Workout,title,39
Behavorial Interview Worksheet,https://docs.google.com/document/d/1ferHwQBVCVAzl44WjF4XMxX9xulqY3vyYwkXEt5ZK4A/preview?tab=t.0#heading=h.gjdgxs,og,"BEHAVIORAL INTERVIEW WORKSHEET    HOW TO USE THIS WORKSHEET Make a copy to your own drive by clicking this link 👈 Research the company/position thoroughly using Glassdoor, LinkedIn, website, blog posts, Twitter, etc. Tailor and complete worksheet/interview study guide based on your research ...",,"BEHAVIORAL INTERVIEW WORKSHEET    HOW TO USE THIS WORKSHEET Make a copy to your own drive by clicking this link 👈 Research the company/position thoroughly using Glassdoor, LinkedIn, website, blog posts, Twitter, etc. Tailor and complete worksheet/interview study guide based on your research ...",,"JavaScript isn't enabled in your browser, so this file can't be opened. Enable and reload.",421797,text/html; charset=utf-8,HTML Pages,"BEHAVIORAL INTERVIEW WORKSHEET    HOW TO USE THIS WORKSHEET Make a copy to your own drive by clicking this link 👈 Research the company/position thoroughly using Glassdoor, LinkedIn, website, blog posts, Twitter, etc. Tailor and complete worksheet/interview study guide based on your research ...",description,295
Big-O Algorithm Complexity Cheat Sheet,https://www.bigocheatsheet.com/,body,"Big-O Cheat Sheet Download PDF Know Thy Complexities! Hi there!  This webpage covers the space and time Big-O complexities of common algorithms used in Computer Science.  When preparing for technical interviews in the past, I found myself spending hours crawling the internet putting together the best, average, and worst case complexities for search and sorting algorithms so that I wouldn't be stum",,,,"Big-O Cheat Sheet Download PDF Know Thy Complexities! Hi there!  This webpage covers the space and time Big-O complexities of common algorithms used in Computer Science.  When preparing for technical interviews in the past, I found myself spending hours crawling the internet putting together the best, average, and worst case complexities for search and sorting algorithms so that I wouldn't be stum",31976,text/html; charset=utf-8,HTML Pages,Big-O Algorithm Complexity Cheat Sheet,description,38
Binary Search,https://leetcode.com/discuss/post/691825/binary-search-for-beginners-problems-pat-0hei/,unknown,,,,,,0,,Unknown/Failed to Load,Binary Search,title,13
Binary Search Tree - Node Insertion & Removal,https://gist.github.com/ascherj/21152c800d892da8a8d5a7a1971df8f5,meta,Binary Search Tree - Node Insertion & Removal Demonstration - bst.py,Binary Search Tree - Node Insertion & Removal Demonstration - bst.py,Binary Search Tree - Node Insertion & Removal Demonstration - bst.py,Binary Search Tree - Node Insertion & Removal Demonstration - bst.py,"Skip to content Search Gists Search Gists All gists Back to GitHub Sign in Sign up Sign in Sign up You signed in with another tab or window. Reload to refresh your session. You signed out in another tab or window. Reload to refresh your session. You switched accounts on another tab or window. Reload to refresh your session. Dismiss alert Instantly share code, notes, and snippets. ascherj / bst.py ",183096,text/html; charset=utf-8,HTML Pages,Binary Search Tree - Node Insertion & Removal Demonstration - bst.py,description,68
Binary Tree Traversal Methods,https://github.com/ascherj/binary-tree-traversal-methods,meta,Contribute to ascherj/binary-search-tree-fundamentals development by creating an account on GitHub.,Contribute to ascherj/binary-search-tree-fundamentals development by creating an account on GitHub.,Contribute to ascherj/binary-search-tree-fundamentals development by creating an account on GitHub.,Contribute to ascherj/binary-search-tree-fundamentals development by creating an account on GitHub.,Skip to content Navigation Menu Toggle navigation Sign in Appearance settings Platform AI CODE CREATION GitHub Copilot Write better code with AI GitHub Spark Build and deploy intelligent apps GitHub Models Manage and compare prompts MCP Registry New Discover and integrate external tools DEVELOPER WORKFLOWS Actions Automate any workflow Codespaces Instant dev environments Issues Plan and track work,300992,text/html; charset=utf-8,HTML Pages,Contribute to ascherj/binary-search-tree-fundamentals development by creating an account on GitHub.,description,99
Binaural Beats Generator — Free Online Tool | Binauro,https://binauro.com/,meta,"Generate binaural beats and ambient sounds online. Free tools for relaxation, focus, sleep, and creativity.","Generate binaural beats and ambient sounds online. Free tools for relaxation, focus, sleep, and creativity.","Generate binaural beats and ambient sounds online. Free tools for relaxation, focus, sleep, and creativity.","Generate binaural beats and ambient sounds online. Free tools for relaxation, focus, sleep, and creativity.",,4561,text/html; charset=utf-8,HTML Pages,"Generate binaural beats and ambient sounds online. Free tools for relaxation, focus, sleep, and creativity.",description,107
Bitwise Manipulation,https://leetcode.com/discuss/post/3695233/all-types-of-patterns-for-bits-manipulat-qezp/,unknown,,,,,,0,,Unknown/Failed to Load,Bitwise Manipulation,title,20
Blind75,https://www.teamblind.com/post/new-year-gift-curated-list-of-top-75-leetcode-questions-to-save-your-time-oam1oreu,meta,"New Year Gift to every fellow time-constrained engineer out there looking for a job, here's a list of the best LeetCode questions that teach you core concepts and techniques for each category/type of problems! Many other LeetCode questions are a mash...","New Year Gift to every fellow time-constrained engineer out there looking for a job, here's a list of the best LeetCode questions that teach you core concepts and techniques for each category/type of problems! Many other LeetCode questions are a mash...","New Year Gift to every fellow time-constrained engineer out there looking for a job, here's a list of the best LeetCode questions that teach you core concepts and techniques for each category/type of problems! Many other LeetCode questions are a mash...","New Year Gift to every fellow time-constrained engineer out there looking for a job, here's a list of the best LeetCode questions that teach you core concepts and techniques for each category/type of problems! Many other LeetCode questions are a mash...",Community Salaries Reviews Jobs For Business Sign in Sign in Community Salaries Reviews Jobs For Business Feed My Company Blind Alters Resources Best of Blind NEW Trending Channels Industries Tech Healthcare Retail Media Finance Transportation Show more Job Groups Software Engineering Product Management Accounting Strategy Data Science Design Information Technology Sales Marketing Hardware Enginee,1072672,text/html; charset=utf-8,HTML Pages,"New Year Gift to every fellow time-constrained engineer out there looking for a job, here's a list of the best LeetCode questions that teach you core concepts and techniques for each category/type of problems! Many other LeetCode questions are a mash...",description,253
Books,https://www.readanybook.com/,meta,"ReadAnyBook - Best e-Library for reading books online. Choice one of 500.000+ free books in our online reader and read text, epub, and fb2 files directly on the page you are browsing. Best fiction, romance, fantasy, young adult, and nonfiction e-books every day!","ReadAnyBook - Best e-Library for reading books online. Choice one of 500.000+ free books in our online reader and read text, epub, and fb2 files directly on the page you are browsing. Best fiction, romance, fantasy, young adult, and nonfiction e-books every day!",ReadAnyBook - Best e-Library for reading books online,,Toggle navigation Search Like site? Add book Sign In Sign In Remember Me New here ? Join Us Free Books to Read Online The Secret of Secrets by Dan Brown 9.5 / 10 Katabasis by R.F. Kuang 5.25 / 10 The Hallmarked Man by Robert Galbraith 4.6 / 10 Sunrise On the Reaping by Suzanne Collins 9.18 / 10 Just for the Summer by Abby Jimenez 6.58 / 10 House of Flame And Shadow by Sarah J. Maas 8.8 / 10 1984 b,226698,text/html; charset=utf-8,HTML Pages,"ReadAnyBook - Best e-Library for reading books online. Choice one of 500.000+ free books in our online reader and read text, epub, and fb2 files directly on the page you are browsing. Best fiction, romance, fantasy, young adult, and nonfiction e-books every day!",description,262
BRATZ,https://www.youtube.com/playlist?list=PLkMGhjcIh--NWmaO-7iBmDWby9KDGMZLY,meta,- Bratz Rock Angelz movie - Bratz season 1 - Genie Magic movie - Passion 4 Fashion movie - Fashion Pixiez movie - Bratz season 2 - Girlz Really Rock movie,- Bratz Rock Angelz movie - Bratz season 1 - Genie Magic movie - Passion 4 Fashion movie - Fashion Pixiez movie - Bratz season 2 - Girlz Really Rock movie,- Bratz Rock Angelz movie - Bratz season 1 - Genie Magic movie - Passion 4 Fashion movie - Fashion Pixiez movie - Bratz season 2 - Girlz Really Rock movie,- Bratz Rock Angelz movie - Bratz season 1 - Genie Magic movie - Passion 4 Fashion movie - Fashion Pixiez movie - Bratz season 2 - Girlz Really Rock movie,About Press Copyright Contact us Creators Advertise Developers Terms Privacy Policy & Safety How YouTube works Test new features NFL Sunday Ticket © 2025 Google LLC,1017337,text/html; charset=utf-8,HTML Pages,- Bratz Rock Angelz movie - Bratz season 1 - Genie Magic movie - Passion 4 Fashion movie - Fashion Pixiez movie - Bratz season 2 - Girlz Really Rock movie,description,154
Breaking Down Behavioural Questions,https://file.notion.so/f/f/c6b584ef-c619-41c1-b571-59d74d86c9d6/566a2715-1f88-4e35-9ff8-5b568454ecc7/Breaking_Down_Behavioural_Questions.pdf?table=block&id=1d5c964d-acba-8026-bc62-f91b359574fa&spaceId=c6b584ef-c619-41c1-b571-59d74d86c9d6&expirationTimestamp=1753063200000&signature=4HxmxAzWarUekVasbgkBsvtKKnAkQSyaHiIcJ1bl8Lg&downloadName=Breaking_Down_Behavioural_Questions.pdf,unknown,,,,,,0,,Unknown/Failed to Load,Breaking Down Behavioural Questions,title,35
Browse Anything,https://platform.browseanything.io/,unknown,,,,,,0,,Unknown/Failed to Load,Browse Anything,title,15
"Browse Standard Ebooks - Standard Ebooks: Free and liberated ebooks, carefully produced for the true book lover",https://standardebooks.org/ebooks?tags%5B%5D=all&query=&sort=default&view=grid&per-page=12,meta,Page 1 of the Standard Ebooks free ebook library,Page 1 of the Standard Ebooks free ebook library,,,Standard Ebooks Following this link will ban your IP for 24 hours Ebooks About Newsletter Get Involved Donate Browse Ebooks Subjects All Adventure Autobiography Biography Children’s Comedy Drama Fantasy Fiction Horror Memoir Mystery Nonfiction Philosophy Poetry Satire Science Fiction Shorts Spirituality Travel Keywords Sort S.E. release date (new → old) Author name (a → z) Reading ease (easy → har,29662,text/html; charset=utf-8,HTML Pages,Page 1 of the Standard Ebooks free ebook library,description,48
